{"attempt_id":"5ae1fe51-3bce-500f-844c-b0974a300272","contract_version":"dev-dispatch.attempt-context/v1","development_id":"dev-fg-369dacf607c1","feedback_index":{"blob_oid":"1042fb052496a58018fe6d960a3db87a9f71f310","digest":"sha256:9abd036e9f532cc243048ed7d4a05264571385d60a26b0c68c4751d428cf67d3","entry_count":1,"path":".dev-dispatch/feedback/index.json"},"implementation_handoff_receipt_digest":"sha256:63689e2ca411b14032591154134afc599d985b93087c8b960b4613ebfe6dd1f2","implementation_subject_commit":"04ef15a36a0e30c9715c2b39cc6d552432eaae27","input_commit":"04ef15a36a0e30c9715c2b39cc6d552432eaae27","materialization_intent_id":"25cf71b2-f34e-5836-90ad-c80ffeca44c1","output_commit":"2603941a91fa4676ba601fbad8fe5372bf647ac5","parent_handoff_receipt_digest":"sha256:63689e2ca411b14032591154134afc599d985b93087c8b960b4613ebfe6dd1f2","review_artifact":{"blob_oid":"79bc33bf1f48bf5916504ed046251e31404d00cb","digest":"sha256:1ff276181361c9ecbe662925fb82fdc31ef263ce82252ce53dcc3a5450b3b6bf","path":".dev-dispatch/reviews/rc-5ae1fe51-3bce-500f-844c-b0974a300272/review.json"},"review_id":"rc-5ae1fe51-3bce-500f-844c-b0974a300272","review_phase":"continuous","reviewer_job_id":"5ae1fe51-3bce-500f-844c-b0974a300272","subject_commit":"04ef15a36a0e30c9715c2b39cc6d552432eaae27","verdict":"APPROVE"}
